{
  "apiVersion": "packages.forms.takoform.com/v1alpha4",
  "kind": "FormPackage",
  "formRef": {
    "apiVersion": "edge.forms.takoform.com/v1beta2",
    "kind": "ObjectBucket",
    "definitionVersion": "0.1.0",
    "schemaDigest": "sha256:4f82026968c3ae98785acfba3c9e4d8e9b8f110c09b9b34ac3043e2d362b5fff"
  },
  "definitionPath": "definition.json",
  "files": [
    {
      "path": "definition.json",
      "mediaType": "application/vnd.takoform.form-definition.v1+json",
      "size": 2103,
      "digest": "sha256:f38630d101533bec403d8224342bc41aa91f0ac7a16224d96debcdaf1a426f8f"
    },
    {
      "path": "fixtures/desired.json",
      "mediaType": "application/json",
      "size": 3,
      "digest": "sha256:ca3d163bab055381827226140568f3bef7eaac187cebd76878e0b63e9e442356"
    },
    {
      "path": "fixtures/negative-unexpected-property.json",
      "mediaType": "application/json",
      "size": 33,
      "digest": "sha256:d10f45f42473405c10b441faafa3d23e863d4160f2ca3a7d0c32874b386f1ae9"
    }
  ]
}
