{
  "apiVersion": "packages.forms.takoform.com/v1alpha4",
  "kind": "FormPackage",
  "formRef": {
    "apiVersion": "edge.forms.takoform.com/v1beta2",
    "kind": "WorkerBundle",
    "definitionVersion": "0.1.0",
    "schemaDigest": "sha256:34952a4003122ea40f394dccc7bd0dc711f2d241036c11ef86ef6cf2782def36"
  },
  "definitionPath": "definition.json",
  "files": [
    {
      "path": "definition.json",
      "mediaType": "application/vnd.takoform.form-definition.v1+json",
      "size": 2723,
      "digest": "sha256:159e0b9362a07c280094670198540f449b101fd09437433b63318cbb93cca45d"
    },
    {
      "path": "fixtures/desired.json",
      "mediaType": "application/json",
      "size": 98,
      "digest": "sha256:3ea06a3004abc68a19bc0f99aaa9579264a0110909e16b7dbd82389369d29af4"
    },
    {
      "path": "fixtures/negative-manifest-digest.json",
      "mediaType": "application/json",
      "size": 65,
      "digest": "sha256:23c2d176ab56f4e71df1b57e8ff53e95615a2293073872453477b40e0ca3ee44"
    },
    {
      "path": "fixtures/negative-missing-manifest-digest.json",
      "mediaType": "application/json",
      "size": 3,
      "digest": "sha256:ca3d163bab055381827226140568f3bef7eaac187cebd76878e0b63e9e442356"
    },
    {
      "path": "fixtures/negative-unexpected-property.json",
      "mediaType": "application/json",
      "size": 128,
      "digest": "sha256:4aa7cc025a071ee222020ac0198d840e7e603484c10428cf7b57ca8972b941c8"
    }
  ]
}
