{
  "apiVersion": "packages.forms.takoform.com/v1alpha4",
  "kind": "FormPackage",
  "formRef": {
    "apiVersion": "edge.forms.takoform.com/v1alpha1",
    "kind": "WorkerEndpoint",
    "definitionVersion": "0.1.0",
    "schemaDigest": "sha256:f5ae65887362a6f9fdb44c2454e14a13dd87ed020073784c9641260a8d94a903"
  },
  "definitionPath": "definition.json",
  "files": [
    {
      "path": "definition.json",
      "mediaType": "application/vnd.takoform.form-definition.v1+json",
      "size": 6198,
      "digest": "sha256:c69634980a438e2a78f6ea21ddea123a99ff620f18bb22498d65fd742734f85a"
    },
    {
      "path": "fixtures/desired.json",
      "mediaType": "application/json",
      "size": 132,
      "digest": "sha256:aec0e1645cb138283ee93c2a056767820506a098cf33faf5f0c9dbefc12b4d5a"
    },
    {
      "path": "fixtures/negative-missing-worker.json",
      "mediaType": "application/json",
      "size": 3,
      "digest": "sha256:ca3d163bab055381827226140568f3bef7eaac187cebd76878e0b63e9e442356"
    },
    {
      "path": "fixtures/negative-unexpected-property.json",
      "mediaType": "application/json",
      "size": 162,
      "digest": "sha256:136d45a3534c77b6ae726b5a22485bf55476bfbec00bb401523a6b818adcff6d"
    },
    {
      "path": "fixtures/negative-worker.json",
      "mediaType": "application/json",
      "size": 138,
      "digest": "sha256:6d4d87de83f11a58ad26e2704855d687f9c8f24cc35ae1c20dae71ee79591915"
    }
  ]
}
