{
  "apiVersion": "packages.forms.takoform.com/v1alpha4",
  "kind": "FormPackage",
  "formRef": {
    "apiVersion": "edge.forms.takoform.com/v1beta2",
    "kind": "SQLiteDatabase",
    "definitionVersion": "0.1.0",
    "schemaDigest": "sha256:eadebe99424db57f5c8eda03d556ccf23f0adcdd510075c73e6b825584915da7"
  },
  "definitionPath": "definition.json",
  "files": [
    {
      "path": "definition.json",
      "mediaType": "application/vnd.takoform.form-definition.v1+json",
      "size": 2325,
      "digest": "sha256:5af7c76a2fb7d5ea1236546915df24ef6b05698e729fc2c5558f5ba588f2e2d2"
    },
    {
      "path": "fixtures/desired.json",
      "mediaType": "application/json",
      "size": 3,
      "digest": "sha256:ca3d163bab055381827226140568f3bef7eaac187cebd76878e0b63e9e442356"
    },
    {
      "path": "fixtures/negative-unexpected-property.json",
      "mediaType": "application/json",
      "size": 33,
      "digest": "sha256:d10f45f42473405c10b441faafa3d23e863d4160f2ca3a7d0c32874b386f1ae9"
    }
  ]
}
