{
  "apiVersion": "packages.forms.takoform.com/v1alpha4",
  "kind": "FormPackage",
  "formRef": {
    "apiVersion": "edge.forms.takoform.com/v1beta2",
    "kind": "QueueConsumer",
    "definitionVersion": "0.1.0",
    "schemaDigest": "sha256:993ba71bbb1add2b96df0bc40a74f6f3e695db36fde974b32701bb76351cf1ca"
  },
  "definitionPath": "definition.json",
  "files": [
    {
      "path": "definition.json",
      "mediaType": "application/vnd.takoform.form-definition.v1+json",
      "size": 10768,
      "digest": "sha256:95264a929c83f3146f7e25c56746fa1b701e173d2d81085dc898faf51b30c521"
    },
    {
      "path": "fixtures/desired.json",
      "mediaType": "application/json",
      "size": 530,
      "digest": "sha256:6eb25507f16c79d59c8ac63796088ce4fba15804eb4ea789871a306580f0004b"
    },
    {
      "path": "fixtures/negative-dead-letter-queue.json",
      "mediaType": "application/json",
      "size": 537,
      "digest": "sha256:6bbe9088d0471ea43b7736904e3b0bd06aa52d5a83afcd8b1a4a6bbab472bdcf"
    },
    {
      "path": "fixtures/negative-max-batch-size.json",
      "mediaType": "application/json",
      "size": 529,
      "digest": "sha256:b423e8c974a7d341c45375e24e1a3412591f919eebf04e9f8dae78215fc80ae8"
    },
    {
      "path": "fixtures/negative-max-batch-timeout-seconds.json",
      "mediaType": "application/json",
      "size": 531,
      "digest": "sha256:8c47a63c735ee12cfc355917de1d5a30f555ee1c606523fe93fcb0b61141b602"
    },
    {
      "path": "fixtures/negative-max-concurrency.json",
      "mediaType": "application/json",
      "size": 530,
      "digest": "sha256:08d89104ba6e2aa887a9514bda77c8a9d6d7c49feb6dd54fd024958628af4b3f"
    },
    {
      "path": "fixtures/negative-max-retries.json",
      "mediaType": "application/json",
      "size": 531,
      "digest": "sha256:6b76d55c6f9a9e1e373559592eb1ac9b2ad72d33a033df6d7d80fb99f988e929"
    },
    {
      "path": "fixtures/negative-missing-max-batch-size.json",
      "mediaType": "application/json",
      "size": 508,
      "digest": "sha256:8242f6b1ae73a657b3548268bdb6b3a41872791db804c014c9372960f84ff21c"
    },
    {
      "path": "fixtures/negative-missing-max-batch-timeout-seconds.json",
      "mediaType": "application/json",
      "size": 499,
      "digest": "sha256:70dcae5f52565d59ec9989210270d7c7cb47d81dda178f88f3df3204c11319dd"
    },
    {
      "path": "fixtures/negative-missing-max-concurrency.json",
      "mediaType": "application/json",
      "size": 507,
      "digest": "sha256:21046a195475bd7d15af30b05970c7e6952c800a1c145e56873b8a972c85702c"
    },
    {
      "path": "fixtures/negative-missing-max-retries.json",
      "mediaType": "application/json",
      "size": 511,
      "digest": "sha256:129d2842037f06db2f90c161357603f3b1b85f66671c91978205fb266ab2aac8"
    },
    {
      "path": "fixtures/negative-missing-queue.json",
      "mediaType": "application/json",
      "size": 393,
      "digest": "sha256:de598acc663d9779d90645aecccdc499a4de54b94ed7c04ba9e8180cb7baf9f1"
    },
    {
      "path": "fixtures/negative-missing-retry-delay-seconds.json",
      "mediaType": "application/json",
      "size": 503,
      "digest": "sha256:6c1e7d5acf537ae944c845297755b6e6ef66e56242ff97fbcca1261248eef6cf"
    },
    {
      "path": "fixtures/negative-missing-worker.json",
      "mediaType": "application/json",
      "size": 402,
      "digest": "sha256:4cf23e6c42febee9928abf4017996771818774a0c6fd64e3c682d60a0089a4b7"
    },
    {
      "path": "fixtures/negative-queue.json",
      "mediaType": "application/json",
      "size": 530,
      "digest": "sha256:84af9983fd3999d01d4c58dee13d922914419d0cd327f5a4ea1d0cf1b481930f"
    },
    {
      "path": "fixtures/negative-retry-delay-seconds.json",
      "mediaType": "application/json",
      "size": 530,
      "digest": "sha256:43030356d8f4ee62a8b4fe8259b23f139e5503af414599d2cf09c83fe02ca8cc"
    },
    {
      "path": "fixtures/negative-unexpected-property.json",
      "mediaType": "application/json",
      "size": 560,
      "digest": "sha256:e78aa12f7f0cd0edf744ff19f58a5123b194b8b1df3c777f57805e0986800649"
    },
    {
      "path": "fixtures/negative-worker.json",
      "mediaType": "application/json",
      "size": 536,
      "digest": "sha256:5581b8241d4e4497aec68614aeb674cb12895dfb7cacf35a627529988933f212"
    }
  ]
}
