{
  "apiVersion": "packages.forms.takoform.com/v1alpha4",
  "kind": "FormPackage",
  "formRef": {
    "apiVersion": "edge.forms.takoform.com/v1alpha1",
    "kind": "QueueConsumer",
    "definitionVersion": "0.1.0",
    "schemaDigest": "sha256:0be5f3315f2728d85a2744cd4c9d594c19b3784def7c8d7f5285740489a6b4ef"
  },
  "definitionPath": "definition.json",
  "files": [
    {
      "path": "definition.json",
      "mediaType": "application/vnd.takoform.form-definition.v1+json",
      "size": 10772,
      "digest": "sha256:79550cc7d0488b1e6d0c6203c931f5b249ae06a028fa5f6ebca170389d41bab2"
    },
    {
      "path": "fixtures/desired.json",
      "mediaType": "application/json",
      "size": 533,
      "digest": "sha256:0965b7175bf2897ac4f484ac95f51eb7e6d3e33efcaeaf9ef8e9aede3e7f1370"
    },
    {
      "path": "fixtures/negative-dead-letter-queue.json",
      "mediaType": "application/json",
      "size": 540,
      "digest": "sha256:69ecc1a084322579d8c3d2639120749064b19e8aa8a30fe4b8768315c893f254"
    },
    {
      "path": "fixtures/negative-max-batch-size.json",
      "mediaType": "application/json",
      "size": 532,
      "digest": "sha256:c92c37d3a5b9d187559a1a1b8ca42c1c302200463198fabd8e4d8e482868ca32"
    },
    {
      "path": "fixtures/negative-max-batch-timeout-seconds.json",
      "mediaType": "application/json",
      "size": 534,
      "digest": "sha256:ac3abfb2b0afa6ac336156f674795d20929b30e70019620fcc1b0f0db04fc1ab"
    },
    {
      "path": "fixtures/negative-max-concurrency.json",
      "mediaType": "application/json",
      "size": 533,
      "digest": "sha256:d88ec4aabdc3f6fd911dbe086dc80e92b5da6252e8976428f50511051aedafb7"
    },
    {
      "path": "fixtures/negative-max-retries.json",
      "mediaType": "application/json",
      "size": 534,
      "digest": "sha256:06dc59633f62261b450b24fa0fbd3294a7b5c9e37748c5008ae3742b117c33d3"
    },
    {
      "path": "fixtures/negative-missing-max-batch-size.json",
      "mediaType": "application/json",
      "size": 511,
      "digest": "sha256:edeb12ff885f69c337f335652b64f063e070b673c256ebb66229a5ae965db758"
    },
    {
      "path": "fixtures/negative-missing-max-batch-timeout-seconds.json",
      "mediaType": "application/json",
      "size": 502,
      "digest": "sha256:f4fbc5cbfc83efb13e66f76f063f90b219d285adb65d2cefe9b93173d82f93ef"
    },
    {
      "path": "fixtures/negative-missing-max-concurrency.json",
      "mediaType": "application/json",
      "size": 510,
      "digest": "sha256:83fe9f4e8638fd18a0fae023ab35efebb55365558c7202fb24894bf499f479f6"
    },
    {
      "path": "fixtures/negative-missing-max-retries.json",
      "mediaType": "application/json",
      "size": 514,
      "digest": "sha256:2407d52b84d1ab49521bf8b98e38ae05b5c611cc5cb56fbdd408961d197db360"
    },
    {
      "path": "fixtures/negative-missing-queue.json",
      "mediaType": "application/json",
      "size": 395,
      "digest": "sha256:203ebda3675ca141f8085be86326412fb7412edd2b94e44b8d3a55fb2b7216c0"
    },
    {
      "path": "fixtures/negative-missing-retry-delay-seconds.json",
      "mediaType": "application/json",
      "size": 506,
      "digest": "sha256:f6b6d4252ed663dca270c06d1fba96e214110fe63be8ec0df5843e573befc946"
    },
    {
      "path": "fixtures/negative-missing-worker.json",
      "mediaType": "application/json",
      "size": 404,
      "digest": "sha256:2bbd2de68e0f3c53da049c8f2c75757e863082c3c047f41c696e44cb5e9313d5"
    },
    {
      "path": "fixtures/negative-queue.json",
      "mediaType": "application/json",
      "size": 533,
      "digest": "sha256:71f0fcba0df7d3f78e273b2c6e8a12e54ca801803acec8b2b53fa813a1774de8"
    },
    {
      "path": "fixtures/negative-retry-delay-seconds.json",
      "mediaType": "application/json",
      "size": 533,
      "digest": "sha256:5f5c2cfd9dc7f65005717999f01a0acbb6b5144f32d428c92353fa56922848f9"
    },
    {
      "path": "fixtures/negative-unexpected-property.json",
      "mediaType": "application/json",
      "size": 563,
      "digest": "sha256:43f26f98b86cda32f207240d77a7937dddb390e517939d4999ea3ce3a93f174e"
    },
    {
      "path": "fixtures/negative-worker.json",
      "mediaType": "application/json",
      "size": 539,
      "digest": "sha256:576be3237c7fa3903a3ff6aa2f4ae8e704fdf827b0e937de800f6e814656d141"
    }
  ]
}
