{
  "apiVersion": "packages.forms.takoform.com/v1alpha4",
  "kind": "FormPackage",
  "formRef": {
    "apiVersion": "edge.forms.takoform.com/v1beta2",
    "kind": "ModuleWorker",
    "definitionVersion": "0.1.0",
    "schemaDigest": "sha256:49a3802e53618c372ffa94a4d2c49d0c6867b7a97d9af685a11c5314d42a160e"
  },
  "definitionPath": "definition.json",
  "files": [
    {
      "path": "definition.json",
      "mediaType": "application/vnd.takoform.form-definition.v1+json",
      "size": 2814,
      "digest": "sha256:9795c635e3ef16b4fa8e6e4f1075e1e26b9a38749e45321af384b213bc4a9843"
    },
    {
      "path": "fixtures/desired.json",
      "mediaType": "application/json",
      "size": 3,
      "digest": "sha256:ca3d163bab055381827226140568f3bef7eaac187cebd76878e0b63e9e442356"
    },
    {
      "path": "fixtures/negative-unexpected-property.json",
      "mediaType": "application/json",
      "size": 33,
      "digest": "sha256:d10f45f42473405c10b441faafa3d23e863d4160f2ca3a7d0c32874b386f1ae9"
    }
  ]
}
